{
  "planId": "bathroom_renovation",
  "version": 1,
  "category": "bathroom_renovation",
  "title": "Bathroom renovation",
  "locale": "en-GB",
  "estimatedMinutes": { "tierA": 8, "tierC": 16 },
  "spaces": ["bathroom"],

  "steps": [
    {
      "id": "getting_started",
      "title": "Let's start with the basics",
      "subtitle": "Three quick questions, then we'll take a look at the room.",
      "targets": [
        {
          "id": "q_scope_headline",
          "mode": "ANSWER",
          "requirement": "REQUIRED",
          "instruction": "What are you hoping to do?",
          "rationale": "Sets the overall shape of the job and determines which later targets apply.",
          "satisfiedBy": ["ANSWER"],
          "question": {
            "factKey": "project.scope_headline",
            "category": "QUALIFYING",
            "options": [
              { "value": "FULL_REFIT", "label": "Replace the whole bathroom" },
              { "value": "PARTIAL", "label": "Replace some things, keep others" },
              { "value": "REFRESH", "label": "Freshen it up — tiles, paint, small changes" },
              { "value": "NOT_SURE", "label": "Not sure yet", "opensOpenItem": true }
            ]
          }
        },
        {
          "id": "q_timing",
          "mode": "ANSWER",
          "requirement": "REQUIRED",
          "instruction": "When would you like the work to start?",
          "rationale": "Timing disqualifies a job faster than almost anything else. Contractors need it in the triage header.",
          "satisfiedBy": ["ANSWER"],
          "question": {
            "factKey": "project.timing.posture",
            "category": "QUALIFYING",
            "options": [
              { "value": "URGENT", "label": "As soon as possible" },
              { "value": "WITHIN_WEEKS", "label": "Within the next month or two" },
              { "value": "FLEXIBLE", "label": "I'm flexible" },
              { "value": "PLANNING_AHEAD", "label": "Just planning ahead for now" }
            ]
          }
        },
        {
          "id": "q_materials",
          "mode": "ANSWER",
          "requirement": "REQUIRED",
          "instruction": "Who should buy the bath, tiles and taps?",
          "hint": "Most people ask the contractor to handle it.",
          "rationale": "Material supply responsibility changes the quote fundamentally and is the most common cause of quotes that cannot be compared.",
          "satisfiedBy": ["ANSWER"],
          "question": {
            "factKey": "project.materials_responsibility",
            "category": "QUALIFYING",
            "options": [
              { "value": "CONTRACTOR", "label": "The contractor — I'd rather they sorted it" },
              { "value": "HOMEOWNER", "label": "I'll buy them myself" },
              { "value": "MIXED", "label": "A bit of both" },
              { "value": "UNDECIDED", "label": "Not sure yet", "opensOpenItem": true }
            ]
          }
        }
      ]
    },

    {
      "id": "room_overview",
      "title": "Let's take a look at your bathroom",
      "subtitle": "Stand in the doorway to start. We'll tell you where to point.",
      "targets": [
        {
          "id": "walkthrough_video",
          "mode": "VIDEO_SEGMENT",
          "requirement": "REQUIRED",
          "subject": "space.bathroom",
          "instruction": "Start at the doorway and slowly turn all the way around",
          "hint": "Nice and slow — about ten seconds for a full turn.",
          "illustration": "walkthrough_turn.svg",
          "guidance": { "type": "DIRECTION", "value": "TURN_SLOWLY", "durationSeconds": 20 },
          "rationale": "One continuous pass gives contractors context and adjacency that a set of stills never conveys. Also the primary frame source for future detection work.",
          "satisfiedBy": ["HUMAN_CAPTURE"],
          "acceptance": { "minDurationSeconds": 12, "minLuxWarn": 40 },
          "fallback": "SKIP_WITH_REASON"
        },
        {
          "id": "wall_left",
          "mode": "PHOTO",
          "requirement": "REQUIRED",
          "subject": "space.bathroom.wall_left",
          "instruction": "Now show us the wall on your left",
          "illustration": "arrow_left.svg",
          "guidance": { "type": "DIRECTION", "value": "LEFT" },
          "rationale": "Wall-by-wall stills give tiling extent, condition and fixture positions at usable resolution.",
          "satisfiedBy": ["HUMAN_CAPTURE"],
          "acceptance": { "minPhotos": 1, "minLuxWarn": 40 }
        },
        {
          "id": "wall_ahead",
          "mode": "PHOTO",
          "requirement": "REQUIRED",
          "subject": "space.bathroom.wall_ahead",
          "instruction": "Now the wall straight ahead of you",
          "guidance": { "type": "DIRECTION", "value": "FORWARD" },
          "rationale": "As above.",
          "satisfiedBy": ["HUMAN_CAPTURE"],
          "acceptance": { "minPhotos": 1 }
        },
        {
          "id": "wall_right",
          "mode": "PHOTO",
          "requirement": "REQUIRED",
          "subject": "space.bathroom.wall_right",
          "instruction": "And the wall on your right",
          "illustration": "arrow_right.svg",
          "guidance": { "type": "DIRECTION", "value": "RIGHT" },
          "rationale": "As above.",
          "satisfiedBy": ["HUMAN_CAPTURE"],
          "acceptance": { "minPhotos": 1 }
        },
        {
          "id": "ceiling",
          "mode": "PHOTO",
          "requirement": "REQUIRED",
          "subject": "space.bathroom.ceiling",
          "instruction": "Point the camera up and show us the ceiling",
          "guidance": { "type": "DIRECTION", "value": "UP" },
          "rationale": "Ceiling condition, staining from leaks above, extractor and lighting positions.",
          "satisfiedBy": ["HUMAN_CAPTURE"],
          "acceptance": { "minPhotos": 1 }
        },
        {
          "id": "floor",
          "mode": "PHOTO",
          "requirement": "REQUIRED",
          "subject": "space.bathroom.floor",
          "instruction": "Now point it down at the floor",
          "guidance": { "type": "DIRECTION", "value": "DOWN" },
          "rationale": "Existing floor finish, levels, and whether the substrate is timber or solid.",
          "satisfiedBy": ["HUMAN_CAPTURE"],
          "acceptance": { "minPhotos": 1 }
        }
      ]
    },

    {
      "id": "fixtures",
      "title": "Now the things in the room",
      "targets": [
        {
          "id": "bath_or_shower",
          "mode": "PHOTO",
          "requirement": "REQUIRED",
          "subject": "element.bath",
          "instruction": "Show us the bath or shower",
          "hint": "Stand back far enough to get the whole thing and the wall behind it.",
          "rationale": "Removal cost, tiling behind, existing taps and screen, waste position.",
          "satisfiedBy": ["HUMAN_CAPTURE", "DETECTION:bath", "DETECTION:shower"],
          "acceptance": { "minPhotos": 1 }
        },
        {
          "id": "wc",
          "mode": "PHOTO",
          "requirement": "REQUIRED",
          "subject": "element.wc",
          "instruction": "Show us the toilet",
          "rationale": "Soil pipe position is the single biggest constraint on bathroom layout changes.",
          "satisfiedBy": ["HUMAN_CAPTURE", "DETECTION:wc"],
          "acceptance": { "minPhotos": 1 }
        },
        {
          "id": "basin",
          "mode": "PHOTO",
          "requirement": "REQUIRED",
          "subject": "element.basin",
          "instruction": "Show us the sink",
          "rationale": "Type, mounting and existing supply positions.",
          "satisfiedBy": ["HUMAN_CAPTURE", "DETECTION:basin"],
          "acceptance": { "minPhotos": 1 }
        },
        {
          "id": "under_basin",
          "mode": "PHOTO",
          "requirement": "REQUIRED",
          "subject": "element.basin.services",
          "instruction": "Now crouch down and show us underneath the sink",
          "hint": "We're looking at the pipes. Use the torch if it's dark.",
          "illustration": "under_basin.svg",
          "guidance": { "type": "DIRECTION", "value": "MOVE_CLOSER" },
          "rationale": "Existing pipework, isolation valves and waste arrangement. Requested by contractors on a large share of bathroom jobs, so it is a required target rather than something they have to ask for.",
          "satisfiedBy": ["HUMAN_CAPTURE"],
          "acceptance": { "minPhotos": 1, "minLuxWarn": 30 },
          "fallback": "SKIP_WITH_REASON"
        },
        {
          "id": "radiator",
          "mode": "PHOTO",
          "requirement": "RECOMMENDED",
          "subject": "element.radiator",
          "instruction": "Is there a radiator or towel rail? Show us that too",
          "rationale": "Heating circuit position and pipe centres.",
          "satisfiedBy": ["HUMAN_CAPTURE", "DETECTION:radiator"],
          "fallback": "SKIP_WITH_REASON"
        },
        {
          "id": "window",
          "mode": "PHOTO",
          "requirement": "CONDITIONAL",
          "condition": "space.bathroom.has_window == true",
          "subject": "element.window",
          "instruction": "Show us the window",
          "rationale": "Reveal depth, sill, tiling around the opening, and ventilation.",
          "satisfiedBy": ["HUMAN_CAPTURE", "DETECTION:window"]
        },
        {
          "id": "door",
          "mode": "PHOTO",
          "requirement": "REQUIRED",
          "subject": "element.door",
          "instruction": "Show us the door, opened",
          "rationale": "Access width for getting a bath in and rubble out, and door swing constraints on layout.",
          "satisfiedBy": ["HUMAN_CAPTURE", "DETECTION:door"]
        },
        {
          "id": "boiler_or_cylinder",
          "mode": "PHOTO",
          "requirement": "RECOMMENDED",
          "instruction": "If you have a boiler or a hot water tank nearby, show us that",